{
  "title": "급식 잔반을 줄이는 학교 실험",
  "subtitle": "학생 참여로 바꾸는 한 끼의 운영",
  "lang": "ko",
  "presenter": {
    "name": "",
    "roles": [],
    "avatar": "",
    "autoDurationSec": 180
  },
  "theme": {
    "style": "dark",
    "accent": "#5e6ad2"
  },
  "scenes": [
    {
      "id": "01-hook",
      "order": 1,
      "technique": "word-relay",
      "purpose": "남기지 않기 → 함께 고르기 → 조금씩 담기",
      "reason": "핵심 관점을 세 단계로 건네 주제를 빠르게 전환한다.",
      "evidence": "현장 데이터는 입력되지 않았다. 복사문은 제안 또는 시범 설계이며, 노트에 가상 값과 확인 필요 사항을 표시했다.",
      "source": "발표자 제안 초안; 외부 출처 자료 미제공",
      "pinVh": 220,
      "pin": true,
      "assets": {},
      "copy": {
        "kicker": "학교 급식",
        "title": "남기지 않기 → 함께 고르기 → 조금씩 담기",
        "lines": [
          "잔반 문제를 개인의 의지 탓으로만 설명하지 않고 선택과 배식 흐름을 살펴본다."
        ]
      },
      "transition": {
        "in": "fade",
        "out": "fade"
      },
      "notes": "핵심 관점을 세 구절로 전한다. 학교별 잔반량 자료는 아직 없다고 밝힌다."
    },
    {
      "id": "02-trial",
      "order": 2,
      "technique": "step-flow",
      "purpose": "점심시간에 바로 시험할 세 가지",
      "reason": "작은 실험을 행동 순서로 나눠 실행 방법을 기억하게 한다.",
      "evidence": "현장 데이터는 입력되지 않았다. 복사문은 제안 또는 시범 설계이며, 노트에 가상 값과 확인 필요 사항을 표시했다.",
      "source": "발표자 제안 초안; 외부 출처 자료 미제공",
      "pinVh": 240,
      "pin": true,
      "assets": {},
      "copy": {
        "kicker": "수업 실험",
        "title": "점심시간에 바로 시험할 세 가지",
        "lines": [
          "관찰: 어떤 메뉴가 남는지 익명 집계",
          "선택: 배식대에 작은 양 선택 표시",
          "피드백: 다음 주에 결과를 학급과 공유"
        ]
      },
      "transition": {
        "in": "fade",
        "out": "fade"
      },
      "notes": "현장 실행 순서다. 알레르기·영양·급식 위생 기준을 먼저 확인해야 한다."
    },
    {
      "id": "03-scorecard",
      "order": 3,
      "technique": "chart-reveal",
      "purpose": "양을 줄이는지, 만족도도 지키는지",
      "reason": "범주별 비교를 막대로 읽게 한다. 수치는 가상 예시 또는 수집 전 시작값으로만 해석한다.",
      "evidence": "현장 데이터는 입력되지 않았다. 복사문은 제안 또는 시범 설계이며, 노트에 가상 값과 확인 필요 사항을 표시했다.",
      "source": "발표자 제안 초안; 외부 출처 자료 미제공",
      "pinVh": 240,
      "pin": true,
      "assets": {},
      "copy": {
        "kicker": "예시 지표",
        "title": "양을 줄이는지, 만족도도 지키는지",
        "lines": [
          "잔반 중량: 0",
          "선택 배식 참여: 0",
          "만족도 응답: 0"
        ]
      },
      "transition": {
        "in": "fade",
        "out": "fade"
      },
      "notes": "0은 수집 전임을 나타내는 시작값이지 조사 결과가 아니다. 세 지표를 함께 보자는 제안이다."
    },
    {
      "id": "04-roles",
      "order": 4,
      "technique": "agenda-path",
      "purpose": "실험은 네 역할이 이어져야 한다",
      "reason": "각 참여자의 일을 경로의 정류장처럼 보여줘 역할의 연결을 설명한다.",
      "evidence": "현장 데이터는 입력되지 않았다. 복사문은 제안 또는 시범 설계이며, 노트에 가상 값과 확인 필요 사항을 표시했다.",
      "source": "발표자 제안 초안; 외부 출처 자료 미제공",
      "pinVh": 240,
      "pin": true,
      "assets": {},
      "copy": {
        "kicker": "운영 합의",
        "title": "실험은 네 역할이 이어져야 한다",
        "lines": [
          "학생: 선택 배식 이용",
          "영양교사: 메뉴와 영양 균형 검토",
          "조리팀: 배식량 기록",
          "환경 동아리: 주간 결과 공유"
        ]
      },
      "transition": {
        "in": "fade",
        "out": "fade"
      },
      "notes": "책임을 특정 개인에게 넘기지 않고 팀으로 조정하는 방식임을 강조한다."
    },
    {
      "id": "05-measure",
      "order": 5,
      "technique": "odometer-stats",
      "purpose": "세 항목을 4주 동안 기록",
      "reason": "계획의 기간과 측정 개수를 숫자로 강조하며 성과값으로 오해하지 않도록 노트에서 구분한다.",
      "evidence": "현장 데이터는 입력되지 않았다. 복사문은 제안 또는 시범 설계이며, 노트에 가상 값과 확인 필요 사항을 표시했다.",
      "source": "발표자 제안 초안; 외부 출처 자료 미제공",
      "pinVh": 220,
      "pin": true,
      "assets": {},
      "copy": {
        "kicker": "측정 약속",
        "title": "세 항목을 4주 동안 기록",
        "lines": [
          "4 주",
          "3 지표",
          "1 주 간격"
        ]
      },
      "transition": {
        "in": "fade",
        "out": "fade"
      },
      "notes": "이는 제안한 실험 설계의 기간과 항목 수다. 절감 성과를 나타내는 수치가 아니다."
    },
    {
      "id": "06-ask",
      "order": 6,
      "technique": "closing-qr",
      "purpose": "다음 점심 한 가지를 바꿔보기",
      "reason": "마지막 장면에서 바로 말할 수 있는 한 가지 행동 요청에 집중한다.",
      "evidence": "현장 데이터는 입력되지 않았다. 복사문은 제안 또는 시범 설계이며, 노트에 가상 값과 확인 필요 사항을 표시했다.",
      "source": "발표자 제안 초안; 외부 출처 자료 미제공",
      "pinVh": 200,
      "pin": true,
      "assets": {
        "images": []
      },
      "copy": {
        "kicker": "첫 행동",
        "title": "다음 점심 한 가지를 바꿔보기",
        "lines": [
          "가장 남기기 쉬운 메뉴와 바꿀 배식 선택지를 적어보기"
        ]
      },
      "transition": {
        "in": "fade",
        "out": "fade"
      },
      "notes": "실제 설문 링크가 없음을 분명히 하고, 자리에서 아이디어 하나를 제안하도록 요청한다."
    }
  ]
}