{
  "title": "동네 도서관은 폭염 쉼터가 될 수 있을까",
  "subtitle": "생활권 회복력의 작은 기반시설",
  "lang": "ko",
  "presenter": {
    "name": "",
    "roles": [],
    "avatar": "",
    "autoDurationSec": 180
  },
  "theme": {
    "style": "light",
    "accent": "#5e6ad2"
  },
  "scenes": [
    {
      "id": "01-frame",
      "order": 1,
      "technique": "kinetic-titles",
      "purpose": "쉼 // 접근 가능한 실내 · 물과 화장실 · 정보가 있는 사람",
      "reason": "세 가지 운영 조건을 시각적으로 이어 하나의 점검 프레임으로 묶는다.",
      "evidence": "현장 데이터는 입력되지 않았다. 복사문은 제안 또는 시범 설계이며, 노트에 가상 값과 확인 필요 사항을 표시했다.",
      "source": "발표자 제안 초안; 외부 출처 자료 미제공",
      "pinVh": 240,
      "pin": true,
      "assets": {},
      "copy": {
        "kicker": "생활권 회복력",
        "title": "쉼 // 접근 가능한 실내 · 물과 화장실 · 정보가 있는 사람",
        "lines": [
          "도서관은 폭염 때 누구에게나 열려 있는가"
        ]
      },
      "transition": {
        "in": "fade",
        "out": "fade"
      },
      "notes": "세 요소를 점검 기준으로 제시한다. 현재 운영 정책을 확인하기 전에는 쉼터라고 단정하지 않는다."
    },
    {
      "id": "02-audience",
      "order": 2,
      "technique": "question-reveal",
      "purpose": "더위가 심한 날, 누구의 이동이 어려운가?",
      "reason": "질문을 먼저 제시하고 단서를 옆에 모아 청중의 경험을 주제의 원인으로 연결한다.",
      "evidence": "현장 데이터는 입력되지 않았다. 복사문은 제안 또는 시범 설계이며, 노트에 가상 값과 확인 필요 사항을 표시했다.",
      "source": "발표자 제안 초안; 외부 출처 자료 미제공",
      "pinVh": 240,
      "pin": true,
      "assets": {},
      "copy": {
        "kicker": "이용자 관점",
        "title": "더위가 심한 날, 누구의 이동이 어려운가?",
        "lines": [
          "어린이: 보호자 동행",
          "고령자: 가까운 휴식처",
          "이동약자: 출입구와 화장실 접근"
        ]
      },
      "transition": {
        "in": "fade",
        "out": "fade"
      },
      "notes": "취약 집단을 일반적으로 열거하고, 도서관 이용자 특성 자료는 없다고 덧붙인다."
    },
    {
      "id": "03-capacity",
      "order": 3,
      "technique": "system-map",
      "purpose": "안전한 쉼터는 운영망이다",
      "reason": "중앙 과제와 주변 역할을 연결해 협업 구조를 한 화면에서 읽게 한다.",
      "evidence": "현장 데이터는 입력되지 않았다. 복사문은 제안 또는 시범 설계이며, 노트에 가상 값과 확인 필요 사항을 표시했다.",
      "source": "발표자 제안 초안; 외부 출처 자료 미제공",
      "pinVh": 240,
      "pin": true,
      "assets": {},
      "copy": {
        "kicker": "운영 체계",
        "title": "안전한 쉼터는 운영망이다",
        "lines": [
          "도서관: 공간·안내",
          "보건소: 건강 정보",
          "주민센터: 지역 공지",
          "이웃: 동행과 발견"
        ]
      },
      "transition": {
        "in": "fade",
        "out": "fade"
      },
      "notes": "실제 기관 간 협약이 있는 것처럼 말하지 않고 필요한 협력 관계를 제안한다."
    },
    {
      "id": "04-readiness",
      "order": 4,
      "technique": "timeline-roadmap",
      "purpose": "여름 전 점검의 순서",
      "reason": "시간 순서로 준비와 학습 단계를 묶어 실행 순서를 전달한다.",
      "evidence": "현장 데이터는 입력되지 않았다. 복사문은 제안 또는 시범 설계이며, 노트에 가상 값과 확인 필요 사항을 표시했다.",
      "source": "발표자 제안 초안; 외부 출처 자료 미제공",
      "pinVh": 240,
      "pin": true,
      "assets": {},
      "copy": {
        "kicker": "준비 단계",
        "title": "여름 전 점검의 순서",
        "lines": [
          "봄: 출입·화장실 접근성 확인: 장애 요소 목록",
          "초여름: 인력·운영시간 검토: 공백 시간 파악",
          "폭염 시: 안내 게시: 이용 방법 전달"
        ]
      },
      "transition": {
        "in": "fade",
        "out": "fade"
      },
      "notes": "일반적인 준비 일정이며, 지역 폭염 대응 지침을 확인해 운영 시간과 안전 기준을 정해야 한다."
    },
    {
      "id": "05-neighborhood",
      "order": 5,
      "technique": "map-route",
      "purpose": "집에서 쉼터까지의 마지막 500미터",
      "reason": "세 개의 추상 정류장으로 관찰 동선을 보여주어 공간적 순서를 빠르게 읽게 한다.",
      "evidence": "현장 데이터는 입력되지 않았다. 복사문은 제안 또는 시범 설계이며, 노트에 가상 값과 확인 필요 사항을 표시했다.",
      "source": "발표자 제안 초안; 외부 출처 자료 미제공",
      "pinVh": 240,
      "pin": true,
      "assets": {
        "images": []
      },
      "copy": {
        "kicker": "동네 연결",
        "title": "집에서 쉼터까지의 마지막 500미터",
        "lines": [
          "주거 골목",
          "그늘 있는 보행로",
          "도서관 입구"
        ]
      },
      "transition": {
        "in": "fade",
        "out": "fade"
      },
      "notes": "추상적 동선도다. 실제 거리나 지도 데이터로 오인되지 않도록 밝힌다."
    },
    {
      "id": "06-choose",
      "order": 6,
      "technique": "option-matrix",
      "purpose": "먼저 개선할 한 가지",
      "reason": "같은 기준으로 대안을 나란히 두어 성급한 단일 해답 대신 토론을 돕는다.",
      "evidence": "현장 데이터는 입력되지 않았다. 복사문은 제안 또는 시범 설계이며, 노트에 가상 값과 확인 필요 사항을 표시했다.",
      "source": "발표자 제안 초안; 외부 출처 자료 미제공",
      "pinVh": 240,
      "pin": true,
      "assets": {},
      "copy": {
        "kicker": "운영 선택",
        "title": "먼저 개선할 한 가지",
        "lines": [
          "입구 안내 표지",
          "물 마시는 곳 안내",
          "휴식 좌석 배치",
          "기준: 접근성, 준비 시간, 담당 인력"
        ]
      },
      "transition": {
        "in": "fade",
        "out": "fade"
      },
      "notes": "후보의 장단점을 이용자와 직원이 함께 평가하자는 제안이며, 어느 대안이 더 효과적이라는 데이터는 없다."
    }
  ]
}