{
  "title": "도시 열섬을 식히는 동네 설계",
  "subtitle": "폭염 대응을 위한 생활권 선택",
  "lang": "ko",
  "presenter": {
    "name": "",
    "roles": [],
    "avatar": "",
    "autoDurationSec": 180
  },
  "theme": {
    "style": "light",
    "accent": "#5e6ad2"
  },
  "scenes": [
    {
      "id": "01-hook",
      "order": 1,
      "technique": "question-reveal",
      "purpose": "그늘은 왜 동네마다 다를까?",
      "reason": "질문을 먼저 제시하고 단서를 옆에 모아 청중의 경험을 주제의 원인으로 연결한다.",
      "evidence": "현장 데이터는 입력되지 않았다. 복사문은 제안 또는 시범 설계이며, 노트에 가상 값과 확인 필요 사항을 표시했다.",
      "source": "발표자 제안 초안; 외부 출처 자료 미제공",
      "pinVh": 240,
      "pin": true,
      "assets": {},
      "copy": {
        "kicker": "폭염 대응",
        "title": "그늘은 왜 동네마다 다를까?",
        "lines": [
          "그늘: 보행로의 연속성",
          "열원: 넓은 포장면",
          "대안: 작은 녹지 연결"
        ]
      },
      "transition": {
        "in": "fade",
        "out": "fade"
      },
      "notes": "질문으로 일상 경험을 열고, 원인을 세 갈래로 예고한다."
    },
    {
      "id": "02-route",
      "order": 2,
      "technique": "map-route",
      "purpose": "그늘이 끊기는 세 구간",
      "reason": "세 개의 추상 정류장으로 관찰 동선을 보여주어 공간적 순서를 빠르게 읽게 한다.",
      "evidence": "현장 데이터는 입력되지 않았다. 복사문은 제안 또는 시범 설계이며, 노트에 가상 값과 확인 필요 사항을 표시했다.",
      "source": "발표자 제안 초안; 외부 출처 자료 미제공",
      "pinVh": 240,
      "pin": true,
      "assets": {
        "images": []
      },
      "copy": {
        "kicker": "생활권 관찰",
        "title": "그늘이 끊기는 세 구간",
        "lines": [
          "학교 앞 횡단로",
          "버스 정류장 주변",
          "시장 입구"
        ]
      },
      "transition": {
        "in": "fade",
        "out": "fade"
      },
      "notes": "동일한 보행 동선에서 그늘이 끊기는 지점을 관찰할 계획을 설명한다. 특정 지역에 대한 실측 결과로 주장하지 않는다."
    },
    {
      "id": "03-example",
      "order": 3,
      "technique": "chart-reveal",
      "purpose": "세 구간을 먼저 비교한다",
      "reason": "범주별 비교를 막대로 읽게 한다. 수치는 가상 예시 또는 수집 전 시작값으로만 해석한다.",
      "evidence": "현장 데이터는 입력되지 않았다. 복사문은 제안 또는 시범 설계이며, 노트에 가상 값과 확인 필요 사항을 표시했다.",
      "source": "발표자 제안 초안; 외부 출처 자료 미제공",
      "pinVh": 240,
      "pin": true,
      "assets": {},
      "copy": {
        "kicker": "설계 예시",
        "title": "세 구간을 먼저 비교한다",
        "lines": [
          "횡단로: 2",
          "정류장: 1",
          "시장 입구: 3"
        ]
      },
      "transition": {
        "in": "fade",
        "out": "fade"
      },
      "notes": "숫자는 우선순위를 설명하는 가상 점수다. 실제 측정치가 아님을 말하고, 현장 점검 항목을 정하는 방법을 설명한다."
    },
    {
      "id": "04-team",
      "order": 4,
      "technique": "system-map",
      "purpose": "그늘 연결 계획",
      "reason": "중앙 과제와 주변 역할을 연결해 협업 구조를 한 화면에서 읽게 한다.",
      "evidence": "현장 데이터는 입력되지 않았다. 복사문은 제안 또는 시범 설계이며, 노트에 가상 값과 확인 필요 사항을 표시했다.",
      "source": "발표자 제안 초안; 외부 출처 자료 미제공",
      "pinVh": 240,
      "pin": true,
      "assets": {},
      "copy": {
        "kicker": "실행 구조",
        "title": "그늘 연결 계획",
        "lines": [
          "주민: 불편 구간 제보",
          "학교: 등하교 동선 기록",
          "구청: 가로수·차양 검토",
          "상인회: 점포 앞 그늘 협력"
        ]
      },
      "transition": {
        "in": "fade",
        "out": "fade"
      },
      "notes": "역할 간 연결을 보여주고, 제안 단계에서 각 주체의 동의를 확인해야 함을 강조한다."
    },
    {
      "id": "05-options",
      "order": 5,
      "technique": "option-matrix",
      "purpose": "작은 개입부터 시험한다",
      "reason": "같은 기준으로 대안을 나란히 두어 성급한 단일 해답 대신 토론을 돕는다.",
      "evidence": "현장 데이터는 입력되지 않았다. 복사문은 제안 또는 시범 설계이며, 노트에 가상 값과 확인 필요 사항을 표시했다.",
      "source": "발표자 제안 초안; 외부 출처 자료 미제공",
      "pinVh": 240,
      "pin": true,
      "assets": {},
      "copy": {
        "kicker": "대안 검토",
        "title": "작은 개입부터 시험한다",
        "lines": [
          "그늘막",
          "화분 그늘길",
          "수목 식재",
          "기준: 설치 속도, 유지관리, 보행 폭"
        ]
      },
      "transition": {
        "in": "fade",
        "out": "fade"
      },
      "notes": "세 대안은 비교를 위한 후보이며 비용이나 효과 순위를 확정하지 않는다. 현장 조건과 보행 폭을 기준으로 함께 고르자고 안내한다."
    },
    {
      "id": "06-pilot",
      "order": 6,
      "technique": "timeline-roadmap",
      "purpose": "한 계절 안에 배우는 순서",
      "reason": "시간 순서로 준비와 학습 단계를 묶어 실행 순서를 전달한다.",
      "evidence": "현장 데이터는 입력되지 않았다. 복사문은 제안 또는 시범 설계이며, 노트에 가상 값과 확인 필요 사항을 표시했다.",
      "source": "발표자 제안 초안; 외부 출처 자료 미제공",
      "pinVh": 240,
      "pin": true,
      "assets": {},
      "copy": {
        "kicker": "시범 일정",
        "title": "한 계절 안에 배우는 순서",
        "lines": [
          "4월: 그늘 조사: 취약 구간 목록",
          "5월: 주민 검토: 우선 지점 합의",
          "6월: 임시 설치: 이용 반응 기록"
        ]
      },
      "transition": {
        "in": "fade",
        "out": "fade"
      },
      "notes": "일정은 제안된 시범사업 예시다. 실제 허가·예산 일정에 맞춰 조정이 필요하다고 설명한다."
    },
    {
      "id": "07-ask",
      "order": 7,
      "technique": "closing-qr",
      "purpose": "집 앞의 뜨거운 길을 알려주세요",
      "reason": "마지막 장면에서 바로 말할 수 있는 한 가지 행동 요청에 집중한다.",
      "evidence": "현장 데이터는 입력되지 않았다. 복사문은 제안 또는 시범 설계이며, 노트에 가상 값과 확인 필요 사항을 표시했다.",
      "source": "발표자 제안 초안; 외부 출처 자료 미제공",
      "pinVh": 200,
      "pin": true,
      "assets": {
        "images": []
      },
      "copy": {
        "kicker": "함께 시작하기",
        "title": "집 앞의 뜨거운 길을 알려주세요",
        "lines": [
          "오늘의 제안: 그늘이 끊기는 구간을 사진과 위치로 기록"
        ]
      },
      "transition": {
        "in": "fade",
        "out": "fade"
      },
      "notes": "참여 행동을 요청한다. 이 덱에는 실제 제보 URL이 없으므로 링크나 QR이 있다고 말하지 않는다."
    }
  ]
}