{
  "title": "모아: 동네 가게의 빈 시간을 채우다",
  "subtitle": "초기 투자 검토용 가상 사업 제안",
  "lang": "ko",
  "presenter": {
    "name": "모아 팀",
    "roles": [],
    "avatar": "",
    "autoDurationSec": 240
  },
  "theme": {
    "style": "dark",
    "accent": "#ffc857"
  },
  "scenes": [
    {
      "id": "01-hero",
      "order": 1,
      "technique": "frame-scrub-hero",
      "pinVh": 280,
      "pin": true,
      "assets": {
        "frames": null,
        "count": 0,
        "critical": [],
        "poster": "/media/investor-pitch/01-hero/hero-v2.webp"
      },
      "copy": {
        "kicker": "동네의 빈 시간에",
        "title": "예약 가능한 자리를 채웁니다",
        "lines": [
          "모아는 가게의 유휴 좌석과 가까운 고객을 연결합니다."
        ]
      },
      "transition": {
        "in": "fade",
        "out": "fade"
      },
      "notes": "밤의 동네 상권 이미지로 문제와 가능성을 한꺼번에 연다. 전부 가상 사례다. 발표 수치와 브랜드는 가상 예시임을 필요한 지점에서 다시 밝혀 주세요.",
      "fallback": "모션을 줄여도 같은 핵심 주장과 근거가 정지 화면에서 읽히도록 구성한다.",
      "purpose": "투자자가 예약 가능한 자리를 채웁니다에 담긴 사업 가정과 검증 필요성을 판단한다.",
      "reason": "비어 있는 테이블과 막 도착한 손님을 같은 저녁 카페 안에 배치해, 예약이 좌석 공백을 가까운 방문으로 바꾼다는 투자 제안의 훅을 한눈에 전달한다."
    },
    {
      "id": "02-problem",
      "order": 2,
      "technique": "question-reveal",
      "pinVh": 210,
      "pin": true,
      "assets": {},
      "copy": {
        "kicker": "좋은 가게도 빈 시간은 생깁니다",
        "title": "수요가 없는 게 아니라, 보이지 않습니다",
        "lines": [
          "평일 오후 좌석은 비어 있고, 고객은 근처에서 선택지를 찾습니다."
        ]
      },
      "transition": {
        "in": "fade",
        "out": "fade"
      },
      "notes": "투자자가 익숙한 낭비 문제를 한 질문으로 연다. 발표 수치와 브랜드는 가상 예시임을 필요한 지점에서 다시 밝혀 주세요.",
      "fallback": "모션을 줄여도 같은 핵심 주장과 근거가 정지 화면에서 읽히도록 구성한다.",
      "purpose": "투자자가 수요가 없는 게 아니라, 보이지 않습니다에 담긴 사업 가정과 검증 필요성을 판단한다.",
      "reason": "“수요가 없는 게 아니라, 보이지 않습니다”이라는 질문·주장을 짧게 먼저 드러내 청중이 “평일 오후 좌석은 비어 있고, 고객은 근처에서 선택지를 찾습니다” 상황을 자기 경험과 연결하고, 뒤이어 제시될 설명의 판단 기준을 세우게 한다."
    },
    {
      "id": "03-market",
      "order": 3,
      "technique": "chart-reveal",
      "pinVh": 210,
      "pin": true,
      "assets": {},
      "copy": {
        "kicker": "가상 시장 가설 · 우선시장 30%",
        "title": "첫 시장은 서울의 독립 카페",
        "lines": [
          "전체 후보 점포: 8,000",
          "우선 검토 점포: 2,400"
        ]
      },
      "transition": {
        "in": "fade",
        "out": "fade"
      },
      "notes": "시장 규모는 검증 전 가설임을 분명히 한다. 발표 수치와 브랜드는 가상 예시임을 필요한 지점에서 다시 밝혀 주세요.",
      "fallback": "모션을 줄여도 같은 핵심 주장과 근거가 정지 화면에서 읽히도록 구성한다.",
      "purpose": "투자자가 초기 공략 가능 점포 2,400곳에 담긴 사업 가정과 검증 필요성을 판단한다.",
      "reason": "서울 독립 카페 8,000곳 중 우선 검토할 2,400곳을 같은 축의 막대로 비교해, 청중이 초기 시장의 범위를 확인하고 30% 선별 가정에 질문하도록 한다.",
      "evidence": "가상 사례를 위해 구성한 수치와 시나리오이며 실제 실적·시험·관측 결과가 아닙니다.",
      "source": "Scrolline Deck 발표 예시의 가상 데이터 (2026)"
    },
    {
      "id": "04-product",
      "order": 4,
      "technique": "tilt-card",
      "pinVh": 210,
      "pin": true,
      "assets": {
        "images": [
          "/media/investor-pitch/04-product/image.webp"
        ],
        "critical": [
          1
        ]
      },
      "copy": {
        "kicker": "가게의 빈 시간을 상품으로",
        "title": "당일 좌석과 메뉴를 간단히 등록",
        "lines": [
          "사장님은 남는 시간만 열고 고객은 할인된 경험을 예약한다.",
          "형태를 먼저 보고 설계 이유를 이어서 설명합니다."
        ]
      },
      "transition": {
        "in": "fade",
        "out": "fade"
      },
      "notes": "제품 화면은 개념 시각화로서 실제 서비스 화면이 아님을 말한다. 발표 수치와 브랜드는 가상 예시임을 필요한 지점에서 다시 밝혀 주세요.",
      "fallback": "모션을 줄여도 같은 핵심 주장과 근거가 정지 화면에서 읽히도록 구성한다.",
      "purpose": "투자자가 당일 좌석과 메뉴를 간단히 등록에 담긴 사업 가정과 검증 필요성을 판단한다.",
      "reason": "“당일 좌석과 메뉴를 간단히 등록”을 물체 중심 카드로 크게 보여 주고 깊이를 더해, “사장님은 남는 시간만 열고 고객은 할인된 경험을 예약한다”에서 말하는 형태·사용 장면을 설명 전에 먼저 관찰하게 한다."
    },
    {
      "id": "05-model",
      "order": 5,
      "technique": "system-map",
      "pinVh": 210,
      "pin": true,
      "assets": {},
      "copy": {
        "kicker": "가상 사례 · 예약 한 건이 매출이 되는 구조",
        "title": "가게 공급 → 근거리 노출 → 예약 결제 → 재방문",
        "lines": [
          "가상 수익모델은 예약액의 12% 중개 수수료다.",
          "화살표는 제안된 흐름을 나타냅니다."
        ]
      },
      "transition": {
        "in": "fade",
        "out": "fade"
      },
      "notes": "돈과 데이터 흐름을 분리해서 단위경제를 설명한다. 발표 수치와 브랜드는 가상 예시임을 필요한 지점에서 다시 밝혀 주세요.",
      "fallback": "모션을 줄여도 같은 핵심 주장과 근거가 정지 화면에서 읽히도록 구성한다.",
      "purpose": "투자자가 가게 공급 → 근거리 노출 → 예약 결제 → 재방문에 담긴 사업 가정과 검증 필요성을 판단한다.",
      "reason": "“가게 공급 → 근거리 노출 → 예약 결제 → 재방문”의 요소와 연결을 동시에 보여 주어 “가상 수익모델은 예약액의 12% 중개 수수료다”에서 설명하는 원인·운영 흐름이 어떻게 이어지는지 파악하게 한다.",
      "evidence": "가상 사례를 위해 구성한 수치와 시나리오이며 실제 실적·시험·관측 결과가 아닙니다.",
      "source": "Scrolline Deck 발표 예시의 가상 데이터 (2026)"
    },
    {
      "id": "06-traction",
      "order": 6,
      "technique": "odometer-stats",
      "pinVh": 210,
      "pin": true,
      "assets": {},
      "copy": {
        "kicker": "가상 사례 · 8주 파일럿의 초기 신호",
        "title": "42개 가게 · 예약 1,860건 · 재방문 31%",
        "lines": [
          "42개 가상 파일럿 참여 가게",
          "1,860건 가상 예약",
          "31% 가상 재방문 비율"
        ]
      },
      "transition": {
        "in": "fade",
        "out": "fade"
      },
      "notes": "지표 정의와 기간을 밝히고 증거 수준을 과장하지 않는다. 발표 수치와 브랜드는 가상 예시임을 필요한 지점에서 다시 밝혀 주세요.",
      "fallback": "모션을 줄여도 같은 핵심 주장과 근거가 정지 화면에서 읽히도록 구성한다.",
      "purpose": "투자자가 42개 가게 · 예약 1,860건 · 재방문 31%에 담긴 사업 가정과 검증 필요성을 판단한다.",
      "reason": "“42개 가게 · 예약 1,860건 · 재방문 31%”의 핵심 지표를 각각 독립된 큰 숫자로 읽게 해, “세 지역, 가상 파일럿 데이터이며 외부 검증 전 수치다”에서 강조하는 규모와 서로 다른 지표의 의미를 혼동하지 않게 한다.",
      "evidence": "가상 사례를 위해 구성한 수치와 시나리오이며 실제 실적·시험·관측 결과가 아닙니다.",
      "source": "Scrolline Deck 발표 예시의 가상 데이터 (2026)"
    },
    {
      "id": "07-economics",
      "order": 7,
      "technique": "annotated-chart",
      "pinVh": 210,
      "pin": true,
      "assets": {
        "series": [
          100,
          82,
          66,
          51,
          34
        ]
      },
      "copy": {
        "kicker": "가상 파일럿 · CAC 지수 (첫 예약=100)",
        "title": "재방문 고객의 획득비는 더 낮다",
        "lines": [
          "해석: 재방문 고객 비용은 첫 예약의 34%",
          "출처: 모아 가상 파일럿 · 채널 비용 상대 지수"
        ]
      },
      "transition": {
        "in": "fade",
        "out": "fade"
      },
      "notes": "축과 비용 산정 범위를 설명한다. 발표 수치와 브랜드는 가상 예시임을 필요한 지점에서 다시 밝혀 주세요.",
      "fallback": "모션을 줄여도 같은 핵심 주장과 근거가 정지 화면에서 읽히도록 구성한다.",
      "purpose": "투자자가 첫 예약 획득비 9,200원 → 재방문 고객 3,100원에 담긴 사업 가정과 검증 필요성을 판단한다.",
      "reason": "“해석: 재방문 고객 비용은 첫 예약의 34%”의 해석을 실제 데이터 계열과 같은 화면에 표시해, 청중이 “재방문 고객의 획득비는 더 낮다”에 해당하는 추세와 근거의 범위를 함께 읽도록 한다.",
      "evidence": "가상 사례를 위해 구성한 수치와 시나리오이며 실제 실적·시험·관측 결과가 아닙니다.",
      "source": "Scrolline Deck 발표 예시의 가상 데이터 (2026)"
    },
    {
      "id": "08-competition",
      "order": 8,
      "technique": "option-matrix",
      "pinVh": 210,
      "pin": true,
      "assets": {
        "matrix": {
          "options": [
            "지도 검색",
            "쿠폰 앱",
            "모아"
          ],
          "criteria": [
            "재고 정보",
            "예약 확정",
            "당일 빈 시간"
          ],
          "values": [
            [
              "장소 정보",
              "제휴 쿠폰",
              "예약 가능 좌석"
            ],
            [
              "전화 확인",
              "쿠폰 사용",
              "즉시 결제"
            ],
            [
              "부분 표시",
              "조건 확인",
              "당일 재고"
            ]
          ]
        }
      },
      "copy": {
        "kicker": "검색 대신 예약 전환에 집중",
        "title": "검색 결과보다 예약 전환에 집중",
        "lines": [
          "지도 검색",
          "쿠폰 앱",
          "모아",
          "기준: 재고 정보 · 예약 확정 · 당일 빈 시간"
        ]
      },
      "transition": {
        "in": "fade",
        "out": "fade"
      },
      "notes": "비교 기준은 고객 행동이며 경쟁사 우열을 단정하지 않는다. 발표 수치와 브랜드는 가상 예시임을 필요한 지점에서 다시 밝혀 주세요.",
      "fallback": "모션을 줄여도 같은 핵심 주장과 근거가 정지 화면에서 읽히도록 구성한다.",
      "purpose": "투자자가 지도 검색 · 쿠폰 앱 · 모아에 담긴 사업 가정과 검증 필요성을 판단한다.",
      "reason": "“검색 결과보다 예약 전환에 집중”의 선택지를 같은 기준의 표에 놓아, “지도 검색” 조건에서 어떤 안이 적합한지 청중이 근거를 보고 판단하게 한다."
    },
    {
      "id": "09-ask",
      "order": 9,
      "technique": "timeline-roadmap",
      "pinVh": 210,
      "pin": true,
      "assets": {},
      "copy": {
        "kicker": "가상 사례 · 12개월 동안 검증할 세 가지",
        "title": "서울 3개 권역 · 점포 500곳 · 재방문 40%",
        "lines": [
          "0–3개월: 공급 확보: 파일럿 가게 150곳",
          "4–8개월: 권역 확장: 서울 3개 구",
          "9–12개월: 재방문 검증: 목표 40%"
        ]
      },
      "transition": {
        "in": "fade",
        "out": "fade"
      },
      "notes": "가상 투자 조건과 자금 사용 계획을 명확히 말한다. 발표 수치와 브랜드는 가상 예시임을 필요한 지점에서 다시 밝혀 주세요.",
      "fallback": "모션을 줄여도 같은 핵심 주장과 근거가 정지 화면에서 읽히도록 구성한다.",
      "purpose": "투자자가 서울 3개 권역 · 점포 500곳 · 재방문 40%에 담긴 사업 가정과 검증 필요성을 판단한다.",
      "reason": "“서울 3개 권역 · 점포 500곳 · 재방문 40%”의 사건을 시간순으로 배치해 “0–3개월: 공급 확보: 파일럿 가게 150곳”에서 말하는 실행 순서와 성과·검토 시점의 관계를 구분하게 한다.",
      "evidence": "가상 사례를 위해 구성한 수치와 시나리오이며 실제 실적·시험·관측 결과가 아닙니다.",
      "source": "Scrolline Deck 발표 예시의 가상 데이터 (2026)"
    },
    {
      "id": "10-close",
      "order": 10,
      "technique": "kinetic-titles",
      "pinVh": 180,
      "pin": true,
      "assets": {},
      "copy": {
        "kicker": "다음 라운드의 질문",
        "title": "빈 시간을 반복 매출로 바꿀 수 있을까요?",
        "lines": [
          "회사·시장·수치 모두 투자 검토를 위한 가상 사례입니다."
        ]
      },
      "transition": {
        "in": "fade",
        "out": "fade"
      },
      "notes": "질문을 받고 핵심 가정 하나씩 검증하는 논의를 제안한다. 발표 수치와 브랜드는 가상 예시임을 필요한 지점에서 다시 밝혀 주세요.",
      "fallback": "모션을 줄여도 같은 핵심 주장과 근거가 정지 화면에서 읽히도록 구성한다.",
      "purpose": "투자자가 빈 시간을 반복 매출로 바꿀 수 있을까요?에 담긴 사업 가정과 검증 필요성을 판단한다.",
      "reason": "“빈 시간을 반복 매출로 바꿀 수 있을까요?”의 핵심 문장을 순차적으로 완성해 시선을 한 주장에 모으고, “회사·시장·수치 모두 투자 검토를 위한 가상 사례입니다”을 기억할 만한 발표의 요지로 남긴다."
    }
  ],
  "links": {
    "site": "https://github.com/gongnyang/awesome-html-scrolline-deck"
  }
}
